<?xml version="1.0" encoding="UTF-8" standalone="yes"?>
<node xmlns:xsi="http://www.w3.org/2001/XMLSchema-instance" xmlns="urn:enonic:xp:export:1.0"
      xsi:schemaLocation="urn:enonic:xp:export:1.0 ../export.xsd">

  <childOrder>_manualordervalue DESC</childOrder>
  <nodeType>content</nodeType>
  <data>
    <string name="test">value</string>
    <double name="test">3232.23</double>
    <long name="test">1234567891011121314</long>
    <geoPoint name="test">large</geoPoint>
    <boolean name="myBoolean">true</boolean>
    <dateTime name="myInstant">2014-11-28T09:10:00Z</dateTime>
    <localDateTime name="myLDT">2014-11-28T09:10:00Z</localDateTime>
    <localDate name="myLocalDate">2014-11-28</localDate>
    <localTime name="myLocalDate">09:10:00</localTime>
    <reference name="myRef">1234567890</reference>
    <link name="myLink">/content/stuff/more/here</link>
    <binaryReference name="myfile">fish_recipe.pdf</binaryReference>
    <htmlPart name="myPart">
      <![CDATA[
        <h1>This is my title</h1>
        <h2>This is my subtitle</h2>
      ]]>
    </htmlPart>
    <xml name="myXml">
      <![CDATA[
       <property-set name="test">
          <property-set name="eee">
              <string name="test">value</string>
          </property-set>
       </property-set>
      ]]>
    </xml>
    <string name="test">value</string>
    <property-set name="test">
      <property-set name="eee">
        <string name="test">value</string>
      </property-set>
    </property-set>
  </data>
  <indexConfigs>
    <analyzer>myAnalyzer</analyzer>
    <defaultConfig>
      <decideByType>false</decideByType>
      <enabled>true</enabled>
      <nGram>true</nGram>
      <fulltext>true</fulltext>
      <includeInAllText>true</includeInAllText>
    </defaultConfig>
    <pathIndexConfigs>
      <pathIndexConfig>
        <indexConfig>
          <decideByType>true</decideByType>
          <enabled>true</enabled>
          <nGram>true</nGram>
          <fulltext>true</fulltext>
          <includeInAllText>true</includeInAllText>
        </indexConfig>
        <path>myProperty</path>
      </pathIndexConfig>
      <pathIndexConfig>
        <indexConfig>
          <decideByType>true</decideByType>
          <enabled>false</enabled>
          <nGram>false</nGram>
          <fulltext>true</fulltext>
          <includeInAllText>false</includeInAllText>
        </indexConfig>
        <path>myOtherProperty</path>
      </pathIndexConfig>
    </pathIndexConfigs>
  </indexConfigs>
</node>
